{
  "wp": "M3-L1",
  "milestone": "M3",
  "attempt": 61,
  "runner": "lead",
  "startedAt": "2026-09-24T15:15:39.944Z",
  "finishedAt": "2026-09-24T15:21:05.248Z",
  "gates": [
    {
      "name": "pnpm verify",
      "exitCode": 1,
      "durationMs": 52386,
      "failingLines": [
        "821:3  error  Remove this unit test or explain why it is ignored  sonarjs/no-skipped-tests",
        "920:3  error  Remove this unit test or explain why it is ignored  sonarjs/no-skipped-tests",
        "✖ 2 problems (2 errors, 0 warnings)",
        "ELIFECYCLE  Command failed with exit code 1.",
        "ELIFECYCLE  Command failed with exit code 1."
      ]
    },
    {
      "name": "format:check",
      "exitCode": 0,
      "durationMs": 4875,
      "failingLines": []
    },
    {
      "name": "typecheck",
      "exitCode": 0,
      "durationMs": 33775,
      "failingLines": []
    },
    {
      "name": "lint",
      "exitCode": 1,
      "durationMs": 232409,
      "failingLines": [
        "821:3  error  Remove this unit test or explain why it is ignored  sonarjs/no-skipped-tests",
        "920:3  error  Remove this unit test or explain why it is ignored  sonarjs/no-skipped-tests",
        "✖ 2 problems (2 errors, 0 warnings)",
        "ELIFECYCLE  Command failed with exit code 1."
      ]
    },
    {
      "name": "vitest run --project unit --changed",
      "exitCode": 0,
      "durationMs": 1302,
      "failingLines": []
    },
    {
      "name": "check:scope",
      "exitCode": 0,
      "durationMs": 498,
      "failingLines": []
    }
  ],
  "scopeViolations": [],
  "filesChanged": 0,
  "suggestedClasses": [
    "GATE_FAILURE"
  ],
  "confirmedClasses": [
    "CONTRACT_DRIFT",
    "GATE_FAILURE"
  ],
  "leadTookOver": true
}
