{
  "wp": "M1-W3",
  "milestone": "M1",
  "attempt": 1,
  "runner": "lead",
  "startedAt": "2026-09-13T12:59:55.865Z",
  "finishedAt": "2026-09-13T13:00:10.109Z",
  "gates": [
    {
      "name": "format:check",
      "exitCode": 0,
      "durationMs": 864,
      "failingLines": []
    },
    {
      "name": "typecheck",
      "exitCode": 0,
      "durationMs": 3195,
      "failingLines": []
    },
    {
      "name": "lint",
      "exitCode": 0,
      "durationMs": 9628,
      "failingLines": []
    },
    {
      "name": "vitest run --changed",
      "exitCode": 0,
      "durationMs": 237,
      "failingLines": []
    },
    {
      "name": "check:scope",
      "exitCode": 0,
      "durationMs": 266,
      "failingLines": []
    }
  ],
  "scopeViolations": [],
  "filesChanged": 32,
  "suggestedClasses": [],
  "confirmedClasses": [],
  "leadTookOver": false
}
