{
  "wp": "M3-L1",
  "milestone": "M3",
  "attempt": 1,
  "runner": "lead",
  "startedAt": "2026-09-14T07:05:27.448Z",
  "finishedAt": "2026-09-14T07:06:08.494Z",
  "gates": [
    {
      "name": "pnpm verify",
      "exitCode": 1,
      "durationMs": 2473,
      "failingLines": [
        "ELIFECYCLE  Command failed with exit code 1.",
        "ELIFECYCLE  Command failed with exit code 1."
      ]
    },
    {
      "name": "format:check",
      "exitCode": 1,
      "durationMs": 2369,
      "failingLines": [
        "ELIFECYCLE  Command failed with exit code 1."
      ]
    },
    {
      "name": "typecheck",
      "exitCode": 1,
      "durationMs": 17100,
      "failingLines": [
        ".next/dev/types/validator.ts(25,44): error TS2344: Type 'Route' does not satisfy the constraint '\"/\"'.",
        ".next/dev/types/validator.ts(25,75): error TS2344: Type 'Route' does not satisfy the constraint '\"/\"'.",
        ".next/dev/types/validator.ts(152,39): error TS2307: Cannot find module '../../../src/app/(app)/onboarding/page.js' or its corresponding type declarations.",
        ".next/dev/types/validator.ts(197,39): error TS2307: Cannot find module '../../../src/app/(app)/settings/branding/page.js' or its corresponding type declarations.",
        ".next/dev/types/validator.ts(206,39): error TS2307: Cannot find module '../../../src/app/(app)/settings/fields/page.js' or its corresponding type declarations.",
        ".next/dev/types/validator.ts(215,39): error TS2307: Cannot find module '../../../src/app/(app)/settings/general/page.js' or its corresponding type declarations.",
        ".next/dev/types/validator.ts(224,39): error TS2307: Cannot find module '../../../src/app/(app)/settings/groups/page.js' or its corresponding type declarations.",
        ".next/dev/types/validator.ts(233,39): error TS2307: Cannot find module '../../../src/app/(app)/settings/import/page.js' or its corresponding type declarations.",
        ".next/dev/types/validator.ts(242,39): error TS2307: Cannot find module '../../../src/app/(app)/settings/members/page.js' or its corresponding type declarations.",
        ".next/dev/types/validator.ts(251,39): error TS2307: Cannot find module '../../../src/app/(app)/settings/modules/page.js' or its corresponding type declarations.",
        ".next/dev/types/validator.ts(260,39): error TS2307: Cannot find module '../../../src/app/(app)/settings/notifications/page.js' or its corresponding type declarations.",
        ".next/dev/types/validator.ts(269,39): error TS2307: Cannot find module '../../../src/app/(app)/settings/profile/page.js' or its corresponding type declarations.",
        ".next/dev/types/validator.ts(278,39): error TS2307: Cannot find module '../../../src/app/(app)/settings/terminology/page.js' or its corresponding type declarations.",
        ".next/dev/types/validator.ts(287,39): error TS2307: Cannot find module '../../../src/app/(app)/settings/views/page.js' or its corresponding type declarations.",
        ".next/dev/types/validator.ts(296,39): error TS2307: Cannot find module '../../../src/app/(app)/settings/workflows/page.js' or its corresponding type declarations.",
        ".next/dev/types/validator.ts(332,39): error TS2307: Cannot find module '../../../src/app/(auth)/forgot-password/page.js' or its corresponding type declarations.",
        ".next/dev/types/validator.ts(341,39): error TS2307: Cannot find module '../../../src/app/(auth)/reset-password/page.js' or its corresponding type declarations.",
        ".next/dev/types/validator.ts(408,39): error TS2307: Cannot find module '../../../src/app/(app)/settings/layout.js' or its corresponding type declarations.",
        ".next/dev/types/validator.ts(417,39): error TS2307: Cannot find module '../../../src/app/(auth)/layout.js' or its corresponding type declarations.",
        "ERR_PNPM_RECURSIVE_EXEC_FIRST_FAIL  Command failed with exit code 2: tsc --noEmit"
      ]
    },
    {
      "name": "lint",
      "exitCode": 0,
      "durationMs": 18126,
      "failingLines": []
    },
    {
      "name": "vitest run --project unit --changed",
      "exitCode": 1,
      "durationMs": 641,
      "failingLines": [
        "⎯⎯⎯⎯⎯⎯ Failed Suites 2 ⎯⎯⎯⎯⎯⎯⎯",
        "FAIL  |unit| packages/adapters/cloudflare/test/intake/turnstile.test.ts [ packages/adapters/cloudflare/test/intake/turnstile.test.ts ]",
        "Error: Cannot find module '../../src/intake/turnstile' imported from /Users/abdullahsaeed/freelance/mirchmedia-projects/crm/ops-platform/packages/adapters/cloudflare/test/intake/turnstile.test.ts",
        "FAIL  |unit| packages/adapters/cloudflare/test/mail/resend-mail-sender.test.ts [ packages/adapters/cloudflare/test/mail/resend-mail-sender.test.ts ]",
        "Error: Cannot find module '../../src/mail/resend-mail-sender' imported from /Users/abdullahsaeed/freelance/mirchmedia-projects/crm/ops-platform/packages/adapters/cloudflare/test/mail/resend-mail-sender.test.ts",
        "Test Files  2 failed | 1 passed (3)"
      ]
    },
    {
      "name": "check:scope",
      "exitCode": 0,
      "durationMs": 275,
      "failingLines": []
    }
  ],
  "scopeViolations": [
    "docs/orchestration/m3/plan.md"
  ],
  "filesChanged": 6,
  "suggestedClasses": [
    "GATE_FAILURE",
    "MISSING_TEST",
    "SCOPE_VIOLATION"
  ],
  "confirmedClasses": [
    "BRAND_OR_VOCAB_LEAK",
    "CONTRACT_DRIFT"
  ],
  "leadTookOver": false
}
