{
  "wp": "M1-W5",
  "milestone": "M1",
  "attempt": 1,
  "runner": "lead",
  "startedAt": "2026-09-13T13:59:05.241Z",
  "finishedAt": "2026-09-13T13:59:22.417Z",
  "gates": [
    {
      "name": "format:check",
      "exitCode": 0,
      "durationMs": 1153,
      "failingLines": []
    },
    {
      "name": "typecheck",
      "exitCode": 0,
      "durationMs": 4081,
      "failingLines": []
    },
    {
      "name": "lint",
      "exitCode": 0,
      "durationMs": 11404,
      "failingLines": []
    },
    {
      "name": "vitest run --changed",
      "exitCode": 0,
      "durationMs": 234,
      "failingLines": []
    },
    {
      "name": "check:scope",
      "exitCode": 0,
      "durationMs": 252,
      "failingLines": []
    }
  ],
  "scopeViolations": [
    "apps/web/src/server/work/set-task-dates.ts"
  ],
  "filesChanged": 14,
  "suggestedClasses": [
    "SCOPE_VIOLATION"
  ],
  "confirmedClasses": [],
  "leadTookOver": false
}
