{
  "wp": "M3-W2",
  "milestone": "M3",
  "attempt": 4,
  "runner": "worker",
  "startedAt": "2026-09-14T09:09:13.845Z",
  "finishedAt": "2026-09-14T09:09:46.956Z",
  "gates": [
    {
      "name": "format:check",
      "exitCode": 0,
      "durationMs": 1802,
      "failingLines": []
    },
    {
      "name": "typecheck",
      "exitCode": 0,
      "durationMs": 6931,
      "failingLines": []
    },
    {
      "name": "lint",
      "exitCode": 0,
      "durationMs": 22629,
      "failingLines": []
    },
    {
      "name": "vitest run --project unit --changed",
      "exitCode": 0,
      "durationMs": 1211,
      "failingLines": []
    },
    {
      "name": "check:scope",
      "exitCode": 1,
      "durationMs": 507,
      "failingLines": [
        "check:scope: Command failed: git rev-parse --abbrev-ref --symbolic-full-name @{upstream}",
        "ELIFECYCLE  Command failed with exit code 1."
      ]
    }
  ],
  "scopeViolations": [],
  "filesChanged": 0,
  "suggestedClasses": [
    "SCOPE_VIOLATION"
  ],
  "confirmedClasses": [
    "ACCESS_SCOPE",
    "PARTIAL_WRITE",
    "RACE_CONDITION",
    "MISSING_TEST",
    "CONTRACT_DRIFT",
    "EDGE_CASE",
    "GATE_FAILURE"
  ],
  "leadTookOver": false
}
