{
  "wp": "M2-W7",
  "milestone": "M2",
  "attempt": 5,
  "runner": "worker",
  "startedAt": "2026-09-13T20:39:34.218Z",
  "finishedAt": "2026-09-13T20:40:51.824Z",
  "gates": [
    {
      "name": "format:check",
      "exitCode": 0,
      "durationMs": 7231,
      "failingLines": []
    },
    {
      "name": "typecheck",
      "exitCode": 0,
      "durationMs": 17336,
      "failingLines": []
    },
    {
      "name": "lint",
      "exitCode": 0,
      "durationMs": 51513,
      "failingLines": []
    },
    {
      "name": "vitest run --project unit --changed",
      "exitCode": 0,
      "durationMs": 907,
      "failingLines": []
    },
    {
      "name": "check:scope",
      "exitCode": 0,
      "durationMs": 516,
      "failingLines": []
    }
  ],
  "scopeViolations": [
    "apps/web/src/app/(app)/contact-record-view.tsx",
    "apps/web/src/app/(app)/copy-button.tsx",
    "apps/web/src/app/(app)/directory-filters.tsx",
    "apps/web/src/app/(app)/directory-form.tsx",
    "apps/web/src/app/(app)/directory-list-view.tsx",
    "apps/web/src/app/(app)/directory-record-view.tsx",
    "apps/web/src/app/(app)/directory-view.tsx",
    "apps/web/src/app/(app)/organization-record-view.tsx",
    "apps/web/test/queries/crm/directory.test.ts"
  ],
  "filesChanged": 26,
  "suggestedClasses": [
    "SCOPE_VIOLATION"
  ],
  "confirmedClasses": [
    "ACCESS_SCOPE",
    "EDGE_CASE"
  ],
  "leadTookOver": false
}
