{
  "wp": "M2-W8",
  "milestone": "M2",
  "attempt": 2,
  "runner": "worker",
  "startedAt": "2026-09-14T03:17:24.073Z",
  "finishedAt": "2026-09-14T03:18:09.308Z",
  "gates": [
    {
      "name": "pnpm db:reset:local && pnpm seed:dev",
      "exitCode": 0,
      "durationMs": 11892,
      "failingLines": []
    },
    {
      "name": "format:check",
      "exitCode": 0,
      "durationMs": 1721,
      "failingLines": []
    },
    {
      "name": "typecheck",
      "exitCode": 0,
      "durationMs": 4357,
      "failingLines": []
    },
    {
      "name": "lint",
      "exitCode": 0,
      "durationMs": 26073,
      "failingLines": []
    },
    {
      "name": "vitest run --project unit --changed",
      "exitCode": 0,
      "durationMs": 733,
      "failingLines": []
    },
    {
      "name": "check:scope",
      "exitCode": 0,
      "durationMs": 374,
      "failingLines": []
    }
  ],
  "scopeViolations": [],
  "filesChanged": 5,
  "suggestedClasses": [],
  "confirmedClasses": [
    "CONTRACT_DRIFT"
  ],
  "leadTookOver": false
}
