{
  "wp": "M3-L1",
  "milestone": "M3",
  "attempt": 48,
  "runner": "lead",
  "startedAt": "2026-09-24T13:05:30.772Z",
  "finishedAt": "2026-09-24T13:07:05.981Z",
  "gates": [
    {
      "name": "pnpm verify",
      "exitCode": 1,
      "durationMs": 51967,
      "failingLines": [
        "17:14  error  Async arrow function has too many statements (26). Maximum allowed is 15  max-statements",
        "✖ 1 problem (1 error, 0 warnings)",
        "ELIFECYCLE  Command failed with exit code 1.",
        "ELIFECYCLE  Command failed with exit code 1."
      ]
    },
    {
      "name": "format:check",
      "exitCode": 0,
      "durationMs": 3204,
      "failingLines": []
    },
    {
      "name": "typecheck",
      "exitCode": 0,
      "durationMs": 9165,
      "failingLines": []
    },
    {
      "name": "lint",
      "exitCode": 1,
      "durationMs": 29915,
      "failingLines": [
        "17:14  error  Async arrow function has too many statements (26). Maximum allowed is 15  max-statements",
        "✖ 1 problem (1 error, 0 warnings)",
        "ELIFECYCLE  Command failed with exit code 1."
      ]
    },
    {
      "name": "vitest run --project unit --changed",
      "exitCode": 0,
      "durationMs": 640,
      "failingLines": []
    },
    {
      "name": "check:scope",
      "exitCode": 0,
      "durationMs": 286,
      "failingLines": []
    }
  ],
  "scopeViolations": [],
  "filesChanged": 0,
  "suggestedClasses": [
    "GATE_FAILURE"
  ],
  "confirmedClasses": [
    "MISSING_TEST",
    "GATE_FAILURE",
    "FLAKY_TEST",
    "BRAND_OR_VOCAB_LEAK",
    "CONTRACT_DRIFT"
  ],
  "leadTookOver": true
}
