{
  "wp": "M3-L1",
  "milestone": "M3",
  "attempt": 12,
  "runner": "lead",
  "startedAt": "2026-09-22T20:40:26.779Z",
  "finishedAt": "2026-09-22T20:42:09.814Z",
  "gates": [
    {
      "name": "pnpm verify",
      "exitCode": 1,
      "durationMs": 49998,
      "failingLines": [
        "ELIFECYCLE  Command failed with exit code 1.",
        "ELIFECYCLE  Command failed with exit code 1."
      ]
    },
    {
      "name": "format:check",
      "exitCode": 0,
      "durationMs": 4061,
      "failingLines": []
    },
    {
      "name": "typecheck",
      "exitCode": 0,
      "durationMs": 10291,
      "failingLines": []
    },
    {
      "name": "lint",
      "exitCode": 0,
      "durationMs": 37279,
      "failingLines": []
    },
    {
      "name": "vitest run --project unit --changed",
      "exitCode": 0,
      "durationMs": 1021,
      "failingLines": []
    },
    {
      "name": "check:scope",
      "exitCode": 0,
      "durationMs": 324,
      "failingLines": []
    }
  ],
  "scopeViolations": [],
  "filesChanged": 20,
  "suggestedClasses": [],
  "confirmedClasses": [
    "CONTRACT_DRIFT",
    "ENV_OR_CREDENTIALS",
    "GATE_FAILURE"
  ],
  "leadTookOver": true
}
