{
  "wp": "M3-L1",
  "milestone": "M3",
  "attempt": 14,
  "runner": "lead",
  "startedAt": "2026-09-22T22:04:42.367Z",
  "finishedAt": "2026-09-22T22:06:31.360Z",
  "gates": [
    {
      "name": "pnpm verify",
      "exitCode": 1,
      "durationMs": 62991,
      "failingLines": [
        "116:18  error  Do not nest ternary expressions                                           no-nested-ternary",
        "116:45  error  Extract this nested ternary operation into an independent statement       sonarjs/no-nested-conditional",
        "129:90  error  Async arrow function has too many statements (18). Maximum allowed is 15  max-statements",
        "151:92  error  Async arrow function has too many statements (22). Maximum allowed is 15  max-statements",
        "✖ 4 problems (4 errors, 0 warnings)",
        "ELIFECYCLE  Command failed with exit code 1.",
        "ELIFECYCLE  Command failed with exit code 1."
      ]
    },
    {
      "name": "format:check",
      "exitCode": 0,
      "durationMs": 3221,
      "failingLines": []
    },
    {
      "name": "typecheck",
      "exitCode": 0,
      "durationMs": 7733,
      "failingLines": []
    },
    {
      "name": "lint",
      "exitCode": 1,
      "durationMs": 32717,
      "failingLines": [
        "116:18  error  Do not nest ternary expressions                                           no-nested-ternary",
        "116:45  error  Extract this nested ternary operation into an independent statement       sonarjs/no-nested-conditional",
        "129:90  error  Async arrow function has too many statements (18). Maximum allowed is 15  max-statements",
        "151:92  error  Async arrow function has too many statements (22). Maximum allowed is 15  max-statements",
        "✖ 4 problems (4 errors, 0 warnings)",
        "ELIFECYCLE  Command failed with exit code 1."
      ]
    },
    {
      "name": "vitest run --project unit --changed",
      "exitCode": 0,
      "durationMs": 1939,
      "failingLines": []
    },
    {
      "name": "check:scope",
      "exitCode": 0,
      "durationMs": 316,
      "failingLines": []
    }
  ],
  "scopeViolations": [],
  "filesChanged": 47,
  "suggestedClasses": [
    "GATE_FAILURE"
  ],
  "confirmedClasses": [
    "MISSING_TEST",
    "GATE_FAILURE"
  ],
  "leadTookOver": true
}
