{
  "wp": "M3-L1",
  "milestone": "M3",
  "attempt": 81,
  "runner": "lead",
  "startedAt": "2026-09-24T19:05:37.184Z",
  "finishedAt": "2026-09-24T19:07:05.043Z",
  "gates": [
    {
      "name": "pnpm verify",
      "exitCode": 1,
      "durationMs": 40365,
      "failingLines": [
        "51:19  error  Define a constant instead of duplicating this literal 4 times  sonarjs/no-duplicate-string",
        "✖ 1 problem (1 error, 0 warnings)",
        "ELIFECYCLE  Command failed with exit code 1.",
        "ELIFECYCLE  Command failed with exit code 1."
      ]
    },
    {
      "name": "format:check",
      "exitCode": 0,
      "durationMs": 3268,
      "failingLines": []
    },
    {
      "name": "typecheck",
      "exitCode": 0,
      "durationMs": 6935,
      "failingLines": []
    },
    {
      "name": "lint",
      "exitCode": 1,
      "durationMs": 36242,
      "failingLines": [
        "51:19  error  Define a constant instead of duplicating this literal 4 times  sonarjs/no-duplicate-string",
        "✖ 1 problem (1 error, 0 warnings)",
        "ELIFECYCLE  Command failed with exit code 1."
      ]
    },
    {
      "name": "vitest run --project unit --changed",
      "exitCode": 0,
      "durationMs": 699,
      "failingLines": []
    },
    {
      "name": "check:scope",
      "exitCode": 0,
      "durationMs": 300,
      "failingLines": []
    }
  ],
  "scopeViolations": [],
  "filesChanged": 1,
  "suggestedClasses": [
    "GATE_FAILURE"
  ],
  "confirmedClasses": [
    "GATE_FAILURE"
  ],
  "leadTookOver": true
}
